{
  "$schema": "https://json-schema.org/draft/2020-12/schema",
  "$id": "https://opensyria.org/schemas/data-universities/universities.schema.json",
  "title": "OpenSyria Universities",
  "type": "array",
  "items": {
    "type": "object",
    "additionalProperties": false,
    "required": [
      "id",
      "name",
      "aliases",
      "institutionType",
      "operationalStatus",
      "foundedYear",
      "website",
      "location",
      "externalIds",
      "sourceIds",
      "sourceReferences",
      "sourceStatus"
    ],
    "properties": {
      "id": {
        "type": "string",
        "pattern": "^sy-[a-z0-9]+(?:-[a-z0-9]+)*$"
      },
      "name": {
        "$ref": "#/$defs/localizedText"
      },
      "aliases": {
        "type": "array",
        "items": {
          "$ref": "#/$defs/alias"
        }
      },
      "institutionType": {
        "type": "string",
        "enum": ["public", "private", "virtual", "technical", "religious", "other"]
      },
      "operationalStatus": {
        "type": "string",
        "enum": ["operating", "planned", "closed", "unknown"]
      },
      "foundedYear": {
        "type": ["integer", "null"],
        "minimum": 1,
        "maximum": 9999
      },
      "website": {
        "type": ["string", "null"],
        "format": "uri"
      },
      "location": {
        "oneOf": [
          {
            "$ref": "#/$defs/location"
          },
          {
            "type": "null"
          }
        ]
      },
      "externalIds": {
        "type": "object",
        "additionalProperties": false,
        "properties": {
          "wikidata": {
            "type": "string",
            "pattern": "^Q[0-9]+$"
          },
          "website": {
            "type": "string",
            "format": "uri"
          },
          "ministryId": {
            "type": "string",
            "minLength": 1
          }
        }
      },
      "sourceIds": {
        "type": "array",
        "items": {
          "type": "string",
          "minLength": 1
        },
        "minItems": 1
      },
      "sourceReferences": {
        "type": "array",
        "items": {
          "type": "object",
          "additionalProperties": false,
          "required": ["sourceId", "accessedAt"],
          "properties": {
            "sourceId": {
              "type": "string",
              "minLength": 1
            },
            "sourceRecordId": {
              "type": "string",
              "minLength": 1
            },
            "sourceRecordDate": {
              "type": "string",
              "pattern": "^[0-9]{4}(?:-[0-9]{2}(?:-[0-9]{2})?)?$"
            },
            "accessedAt": {
              "type": "string",
              "format": "date-time"
            }
          }
        },
        "minItems": 1
      },
      "sourceStatus": {
        "type": "string",
        "enum": ["pending_release", "seed", "released", "deprecated"]
      },
      "notes": {
        "type": "string",
        "minLength": 1
      }
    }
  },
  "$defs": {
    "localizedText": {
      "type": "object",
      "additionalProperties": false,
      "required": ["en"],
      "properties": {
        "en": {
          "type": "string",
          "minLength": 1
        },
        "ar": {
          "type": "string",
          "minLength": 1
        }
      }
    },
    "point": {
      "type": "object",
      "additionalProperties": false,
      "required": ["latitude", "longitude"],
      "properties": {
        "latitude": {
          "type": "number",
          "minimum": -90,
          "maximum": 90
        },
        "longitude": {
          "type": "number",
          "minimum": -180,
          "maximum": 180
        }
      }
    },
    "alias": {
      "type": "object",
      "additionalProperties": false,
      "required": ["value"],
      "properties": {
        "value": {
          "type": "string",
          "minLength": 1
        },
        "language": {
          "type": "string",
          "enum": ["ar", "en", "und"]
        },
        "type": {
          "type": "string",
          "enum": ["alias", "formal", "transliteration", "historical", "alternate_spelling"]
        }
      }
    },
    "location": {
      "type": "object",
      "additionalProperties": false,
      "properties": {
        "governorate": {
          "$ref": "#/$defs/localizedText"
        },
        "locality": {
          "$ref": "#/$defs/localizedText"
        },
        "address": {
          "$ref": "#/$defs/localizedText"
        },
        "centroid": {
          "oneOf": [
            {
              "$ref": "#/$defs/point"
            },
            {
              "type": "null"
            }
          ]
        }
      }
    }
  }
}
