{
  "id": "sy-damascus-university",
  "name": {
    "en": "Damascus University",
    "ar": "جامعة دمشق"
  },
  "aliases": [
    {
      "value": "University of Damascus",
      "language": "en",
      "type": "alias"
    }
  ],
  "institutionType": "public",
  "operationalStatus": "operating",
  "foundedYear": 1923,
  "website": "https://damascusuniversity.edu.sy/",
  "location": {
    "governorate": {
      "en": "Damascus",
      "ar": "دمشق"
    },
    "locality": {
      "en": "Damascus",
      "ar": "دمشق"
    },
    "centroid": null
  },
  "externalIds": {
    "website": "https://damascusuniversity.edu.sy/"
  },
  "sourceIds": ["fixture-university-source"],
  "sourceReferences": [
    {
      "sourceId": "fixture-university-source",
      "accessedAt": "2026-01-01T00:00:00.000Z"
    }
  ],
  "sourceStatus": "released"
}
